{"schema_version":1,"clip_id":"seq011","layer":"density","type":"grid","frame_size":[1920,1080],"grid":{"rows":9,"cols":16},"units":"people_per_cell","fields":["density"],"max_age_frames":25,"frames":{"0":{"valid":[[1,1,1,1,1,1,1,1,1,1,1,1,1,1,1,1],[1,1,1,1,1,1,1,1,1,1,1,1,1,1,1,1],[1,1,1,1,1,1,1,1,1,1,1,1,1,1,1,1],[1,1,1,1,1,1,1,1,1,1,1,1,1,1,1,1],[1,1,1,1,1,1,1,1,1,1,1,1,1,1,1,1],[1,1,1,1,1,1,1,1,1,1,1,1,1,1,1,1],[1,1,1,1,1,1,1,1,1,1,1,1,1,1,1,1],[1,1,1,1,1,1,1,1,1,1,1,1,1,1,1,1],[1,1,1,1,1,1,1,1,1,1,1,1,1,1,1,1]],"density":[[0.0,0.0,0.0,0.0,0.0,0.0,0.0,1.765,6.527,1.046,0.0,0.0,0.0,0.0,0.0,0.0],[0.0,0.0,0.0,0.0,0.0,0.0,0.0,2.927,12.533,8.472,0.0,0.0,0.0,0.0,0.0,0.0],[0.0,0.555,0.0,0.0,0.415,0.0,0.0,1.67,6.334,0.0,0.0,0.0,0.0,0.0,0.0,0.0],[4.351,0.719,0.581,0.0,0.0,0.0,2.544,15.386,8.527,4.684,4.619,0.0,3.282,1.481,1.408,1.497],[1.859,0.619,1.369,2.305,0.0,0.72,0.628,4.18,10.786,11.178,5.564,9.881,7.793,3.783,3.072,7.205],[0.0,0.0,0.0,0.727,0.0,0.162,0.063,6.816,8.009,2.936,0.0,0.0,0.0,0.131,0.0,0.0],[0.0,0.0,0.0,0.0,0.0,0.0,0.0,1.465,5.0,0.0,0.0,0.0,0.0,0.0,0.0,0.0],[0.0,0.0,0.0,0.0,0.0,0.0,0.0,5.623,1.187,0.0,0.0,0.0,1.483,0.0,0.0,0.0],[0.0,0.0,0.0,0.0,0.178,0.0,0.0,0.269,0.973,0.296,0.0,0.0,0.13,0.0,0.0,0.163]]},"25":{"valid":[[1,1,1,1,1,1,1,1,1,1,1,1,1,1,1,1],[1,1,1,1,1,1,1,1,1,1,1,1,1,1,1,1],[1,1,1,1,1,1,1,1,1,1,1,1,1,1,1,1],[1,1,1,1,1,1,1,1,1,1,1,1,1,1,1,1],[1,1,1,1,1,1,1,1,1,1,1,1,1,1,1,1],[1,1,1,1,1,1,1,1,1,1,1,1,1,1,1,1],[1,1,1,1,1,1,1,1,1,1,1,1,1,1,1,1],[1,1,1,1,1,1,1,1,1,1,1,1,1,1,1,1],[1,1,1,1,1,1,1,1,1,1,1,1,1,1,1,1]],"density":[[0.0,0.0,0.0,0.0,0.0,0.0,0.0,2.133,5.911,0.829,0.0,0.0,0.0,0.0,0.0,0.0],[0.0,0.0,0.0,0.0,0.0,0.0,0.0,3.662,11.79,6.223,0.0,0.0,0.0,0.0,0.0,0.0],[0.0,0.385,0.0,0.0,0.0,0.0,0.0,1.263,6.325,0.0,0.0,0.0,0.0,0.0,0.0,0.0],[4.204,0.948,0.29,0.0,0.0,0.0,2.626,15.777,8.753,5.632,4.161,0.0,3.266,2.27,0.649,1.552],[1.278,1.71,0.198,1.806,0.0,0.002,0.0,6.354,10.901,10.648,5.935,7.668,8.216,4.136,2.651,8.782],[0.0,0.0,0.0,0.0,0.0,0.055,0.0,6.655,6.615,1.404,0.0,0.0,0.0,0.0,0.0,0.0],[0.0,0.0,0.0,0.0,0.0,0.0,0.0,0.841,4.17,0.0,0.0,0.0,0.0,0.0,0.0,0.0],[0.0,0.0,0.0,0.0,0.155,0.0,0.0,3.775,0.86,0.0,0.0,0.0,1.479,0.0,0.0,0.0],[0.0,0.0,0.0,0.0,2.856,0.0,0.0,0.403,0.0,0.0,0.205,0.0,0.104,0.0,0.0,0.0]]},"50":{"valid":[[1,1,1,1,1,1,1,1,1,1,1,1,1,1,1,1],[1,1,1,1,1,1,1,1,1,1,1,1,1,1,1,1],[1,1,1,1,1,1,1,1,1,1,1,1,1,1,1,1],[1,1,1,1,1,1,1,1,1,1,1,1,1,1,1,1],[1,1,1,1,1,1,1,1,1,1,1,1,1,1,1,1],[1,1,1,1,1,1,1,1,1,1,1,1,1,1,1,1],[1,1,1,1,1,1,1,1,1,1,1,1,1,1,1,1],[1,1,1,1,1,1,1,1,1,1,1,1,1,1,1,1],[1,1,1,1,1,1,1,1,1,1,1,1,1,1,1,1]],"density":[[0.0,0.0,0.0,0.0,0.0,0.0,0.0,4.087,8.297,1.728,0.0,0.0,0.0,0.0,0.0,0.0],[0.0,0.0,0.0,0.0,0.0,0.0,0.0,4.379,15.854,4.257,0.0,0.0,0.0,0.0,0.0,0.0],[0.0,0.417,0.0,0.0,0.0,0.0,0.0,1.851,3.804,0.084,0.0,0.0,0.0,0.0,0.0,0.0],[3.949,0.751,0.0,0.0,0.0,0.0,4.104,14.467,6.523,2.371,4.125,0.654,4.251,2.586,1.884,2.732],[0.273,1.488,0.601,1.192,0.0,0.0,0.0,7.246,11.025,11.026,6.702,8.094,7.722,5.146,3.654,6.672],[0.0,0.0,0.0,0.684,0.0,0.0,0.0,5.217,8.674,2.236,0.0,0.0,0.0,0.782,0.0,0.0],[0.0,0.0,0.0,0.0,0.0,0.0,0.0,2.702,2.917,0.0,0.0,0.0,0.0,0.0,0.0,0.0],[0.0,0.0,0.0,0.0,0.318,0.0,0.0,4.547,1.369,0.0,0.0,0.0,0.392,0.0,0.0,0.0],[0.0,0.0,0.0,0.0,1.184,0.0,0.0,1.74,0.0,0.0,0.982,0.0,0.0,0.0,0.0,0.908]]},"75":{"valid":[[1,1,1,1,1,1,1,1,1,1,1,1,1,1,1,1],[1,1,1,1,1,1,1,1,1,1,1,1,1,1,1,1],[1,1,1,1,1,1,1,1,1,1,1,1,1,1,1,1],[1,1,1,1,1,1,1,1,1,1,1,1,1,1,1,1],[1,1,1,1,1,1,1,1,1,1,1,1,1,1,1,1],[1,1,1,1,1,1,1,1,1,1,1,1,1,1,1,1],[1,1,1,1,1,1,1,1,1,1,1,1,1,1,1,1],[1,1,1,1,1,1,1,1,1,1,1,1,1,1,1,1],[1,1,1,1,1,1,1,1,1,1,1,1,1,1,1,1]],"density":[[0.0,0.0,0.0,0.0,0.0,0.0,0.0,2.354,7.874,3.632,0.0,0.0,0.0,0.0,0.0,0.0],[0.0,0.0,0.0,0.0,0.0,0.0,0.0,3.886,16.516,4.864,0.0,0.0,0.0,0.0,0.0,0.0],[0.0,0.116,0.0,0.0,0.0,0.0,0.0,2.189,3.598,0.0,0.0,0.0,0.0,0.0,0.0,0.0],[5.722,0.448,0.0,0.0,0.0,0.0,4.411,17.227,9.676,3.356,4.604,0.54,2.987,2.959,1.247,1.497],[0.515,2.489,0.037,1.175,0.0,0.0,0.933,10.49,9.49,11.794,7.415,5.752,6.832,5.094,5.322,4.714],[0.0,0.0,0.0,0.0,0.0,0.0,0.0,5.699,2.613,1.863,0.0,0.0,0.0,0.095,0.0,0.0],[0.0,0.0,0.0,0.0,0.0,0.0,0.0,2.927,4.023,0.0,0.0,0.0,0.0,0.0,0.0,0.0],[0.0,0.0,0.0,0.0,0.0,0.0,0.0,2.399,1.091,0.0,0.0,0.0,1.578,0.0,0.0,0.0],[0.0,0.0,0.0,0.0,0.0,0.0,0.0,1.676,0.615,0.0,1.006,0.0,0.0,0.0,0.0,0.054]]},"100":{"valid":[[1,1,1,1,1,1,1,1,1,1,1,1,1,1,1,1],[1,1,1,1,1,1,1,1,1,1,1,1,1,1,1,1],[1,1,1,1,1,1,1,1,1,1,1,1,1,1,1,1],[1,1,1,1,1,1,1,1,1,1,1,1,1,1,1,1],[1,1,1,1,1,1,1,1,1,1,1,1,1,1,1,1],[1,1,1,1,1,1,1,1,1,1,1,1,1,1,1,1],[1,1,1,1,1,1,1,1,1,1,1,1,1,1,1,1],[1,1,1,1,1,1,1,1,1,1,1,1,1,1,1,1],[1,1,1,1,1,1,1,1,1,1,1,1,1,1,1,1]],"density":[[0.0,0.0,0.0,0.0,0.0,0.0,0.0,3.461,13.137,4.42,0.0,0.0,0.0,0.0,0.0,0.0],[0.0,0.0,0.207,0.0,0.0,0.0,0.0,6.232,12.786,3.475,0.0,0.0,0.0,0.0,0.0,0.0],[0.0,0.0,0.0,0.0,0.058,0.0,0.0,2.529,2.973,0.0,0.0,0.0,0.0,0.0,0.0,0.0],[6.201,0.837,0.0,0.0,0.0,0.272,4.6,7.13,11.855,4.52,2.784,1.286,3.148,1.338,3.339,1.627],[0.33,1.724,0.628,1.247,0.0,0.0,0.738,10.561,8.921,11.054,8.411,7.485,6.674,5.117,5.853,9.634],[0.0,0.0,0.0,0.0,0.0,0.0,0.0,4.757,4.018,0.928,0.0,0.0,0.0,0.657,0.0,0.0],[0.0,0.0,0.0,0.0,0.0,0.0,0.0,4.617,2.937,0.0,0.0,0.0,0.0,0.0,0.0,0.0],[0.0,0.0,0.0,0.0,0.815,0.0,0.0,1.467,3.226,0.0,0.0,0.0,0.843,0.0,0.0,0.0],[0.0,0.0,0.0,0.0,0.712,0.0,0.0,0.218,0.059,0.016,0.352,0.261,0.0,0.0,0.0,0.0]]},"125":{"valid":[[1,1,1,1,1,1,1,1,1,1,1,1,1,1,1,1],[1,1,1,1,1,1,1,1,1,1,1,1,1,1,1,1],[1,1,1,1,1,1,1,1,1,1,1,1,1,1,1,1],[1,1,1,1,1,1,1,1,1,1,1,1,1,1,1,1],[1,1,1,1,1,1,1,1,1,1,1,1,1,1,1,1],[1,1,1,1,1,1,1,1,1,1,1,1,1,1,1,1],[1,1,1,1,1,1,1,1,1,1,1,1,1,1,1,1],[1,1,1,1,1,1,1,1,1,1,1,1,1,1,1,1],[1,1,1,1,1,1,1,1,1,1,1,1,1,1,1,1]],"density":[[0.0,0.0,0.0,0.0,0.0,0.0,0.0,4.887,15.918,3.921,0.0,0.0,0.0,0.0,0.0,0.0],[0.0,0.0,0.0,0.0,0.0,0.0,0.0,6.679,9.705,2.921,0.0,0.0,0.0,0.0,0.0,0.0],[0.0,0.0,0.0,0.0,0.0,0.0,0.0,3.29,3.216,0.0,0.0,0.0,0.0,0.0,0.0,0.0],[5.825,0.838,0.263,0.0,0.0,0.0,4.016,11.123,8.744,4.896,1.72,2.083,2.753,1.025,3.503,3.048],[0.277,2.458,0.0,0.769,0.308,0.028,0.0,10.771,9.012,9.199,5.814,6.494,6.273,5.654,4.944,5.771],[0.0,0.0,0.0,0.0,0.0,0.015,0.0,4.938,3.773,1.354,0.0,0.0,0.0,0.199,0.0,0.0],[0.0,0.0,0.0,0.0,0.0,0.0,0.0,2.947,1.594,0.0,0.0,0.0,0.0,0.0,0.0,0.0],[0.0,0.0,0.0,0.0,0.833,0.0,0.0,2.115,3.476,0.0,0.0,0.0,1.405,0.0,0.0,0.0],[0.0,0.0,0.0,0.0,0.375,0.0,0.0,0.676,0.0,0.0,0.0,0.204,0.0,0.0,0.0,0.0]]},"150":{"valid":[[1,1,1,1,1,1,1,1,1,1,1,1,1,1,1,1],[1,1,1,1,1,1,1,1,1,1,1,1,1,1,1,1],[1,1,1,1,1,1,1,1,1,1,1,1,1,1,1,1],[1,1,1,1,1,1,1,1,1,1,1,1,1,1,1,1],[1,1,1,1,1,1,1,1,1,1,1,1,1,1,1,1],[1,1,1,1,1,1,1,1,1,1,1,1,1,1,1,1],[1,1,1,1,1,1,1,1,1,1,1,1,1,1,1,1],[1,1,1,1,1,1,1,1,1,1,1,1,1,1,1,1],[1,1,1,1,1,1,1,1,1,1,1,1,1,1,1,1]],"density":[[0.0,0.0,0.0,0.0,0.0,0.0,0.0,3.605,8.927,0.303,0.0,0.0,0.0,0.0,0.0,0.0],[0.0,0.0,0.046,0.0,0.0,0.0,0.0,7.25,10.971,3.66,0.0,0.0,0.0,0.0,0.0,0.0],[0.0,0.0,0.0,0.0,0.0,0.0,0.0,2.952,3.283,0.0,0.0,0.0,0.0,0.0,0.0,0.0],[5.059,0.877,0.992,0.0,0.0,0.0,3.539,10.707,8.586,7.095,2.284,2.07,2.52,2.917,3.553,3.033],[0.966,1.524,0.0,0.0,1.07,0.0,1.546,11.38,10.668,10.694,6.341,7.2,6.507,5.158,4.174,6.535],[0.0,0.0,0.0,0.0,0.0,0.0,0.0,4.172,8.082,1.215,0.0,0.0,0.0,0.481,0.0,0.0],[0.0,0.0,0.0,0.0,0.0,0.0,0.0,2.239,2.099,0.0,0.0,0.0,0.0,0.0,0.0,0.0],[0.0,0.0,0.0,0.0,0.601,0.0,0.0,3.834,2.867,0.0,0.0,0.0,1.557,0.0,0.0,0.0],[0.0,0.0,0.0,0.082,1.318,0.0,0.0,2.003,0.0,0.0,0.0,1.111,0.0,0.0,0.0,0.0]]},"175":{"valid":[[1,1,1,1,1,1,1,1,1,1,1,1,1,1,1,1],[1,1,1,1,1,1,1,1,1,1,1,1,1,1,1,1],[1,1,1,1,1,1,1,1,1,1,1,1,1,1,1,1],[1,1,1,1,1,1,1,1,1,1,1,1,1,1,1,1],[1,1,1,1,1,1,1,1,1,1,1,1,1,1,1,1],[1,1,1,1,1,1,1,1,1,1,1,1,1,1,1,1],[1,1,1,1,1,1,1,1,1,1,1,1,1,1,1,1],[1,1,1,1,1,1,1,1,1,1,1,1,1,1,1,1],[1,1,1,1,1,1,1,1,1,1,1,1,1,1,1,1]],"density":[[0.0,0.0,0.0,0.0,0.0,0.0,0.0,3.912,13.982,1.793,0.0,0.0,0.0,0.0,0.0,0.0],[0.0,0.0,0.0,0.0,0.0,0.0,0.0,6.386,11.571,5.043,0.0,0.0,0.0,0.0,0.0,0.0],[0.0,0.195,0.0,0.0,0.0,0.0,0.0,4.193,3.069,0.0,0.0,0.0,0.0,0.0,0.0,0.0],[5.205,0.047,1.054,0.0,0.0,0.0,1.037,9.6,7.186,6.218,1.717,2.058,3.178,2.568,2.193,2.06],[2.041,1.12,0.0,0.0,1.804,0.0,2.625,12.774,7.974,6.866,6.213,5.014,8.329,5.147,6.673,3.487],[0.0,0.0,0.0,0.0,0.0,0.0,0.0,5.185,8.356,0.908,0.0,0.0,0.0,0.07,0.0,0.0],[0.0,0.0,0.0,0.0,0.0,0.0,0.0,2.719,1.579,0.0,0.0,0.0,0.0,0.0,0.0,0.385],[0.0,0.0,0.0,0.0,0.142,0.0,0.0,1.626,0.584,0.0,0.0,0.0,1.569,0.0,0.0,1.694],[0.0,0.0,0.0,0.0,0.078,0.0,0.0,0.311,1.127,0.0,0.0,1.422,0.0,0.0,0.0,0.106]]},"200":{"valid":[[1,1,1,1,1,1,1,1,1,1,1,1,1,1,1,1],[1,1,1,1,1,1,1,1,1,1,1,1,1,1,1,1],[1,1,1,1,1,1,1,1,1,1,1,1,1,1,1,1],[1,1,1,1,1,1,1,1,1,1,1,1,1,1,1,1],[1,1,1,1,1,1,1,1,1,1,1,1,1,1,1,1],[1,1,1,1,1,1,1,1,1,1,1,1,1,1,1,1],[1,1,1,1,1,1,1,1,1,1,1,1,1,1,1,1],[1,1,1,1,1,1,1,1,1,1,1,1,1,1,1,1],[1,1,1,1,1,1,1,1,1,1,1,1,1,1,1,1]],"density":[[0.0,0.0,0.0,0.0,0.0,0.0,0.0,1.883,16.269,3.824,0.0,0.0,0.0,0.0,0.0,0.0],[0.0,0.0,0.0,0.0,0.0,0.0,0.0,7.69,12.96,4.644,0.0,0.0,0.0,0.0,0.0,0.0],[0.0,0.149,0.0,0.0,0.0,0.0,0.0,4.044,2.881,0.0,0.0,0.0,0.0,0.0,0.0,0.0],[6.321,0.153,1.802,0.0,0.0,0.256,2.071,11.485,4.497,7.244,1.773,2.067,3.472,2.854,2.659,2.083],[2.497,0.05,0.0,0.0,0.984,0.025,1.978,12.635,10.862,8.82,6.374,7.994,7.581,1.46,4.614,6.26],[0.0,0.0,0.0,0.0,0.0,0.0,0.0,3.748,9.65,0.825,0.0,0.0,0.0,0.229,0.0,0.0],[0.0,0.0,0.0,0.0,0.281,0.0,0.0,1.412,1.917,0.0,0.0,0.0,0.0,0.0,0.041,0.0],[0.0,0.0,0.0,0.0,0.0,0.0,0.0,2.755,1.116,0.0,0.0,0.0,1.463,0.0,0.0,0.386],[0.0,0.0,0.0,0.0,0.0,0.0,0.0,3.577,1.326,0.0,0.261,1.045,0.0,0.0,0.0,0.0]]},"225":{"valid":[[1,1,1,1,1,1,1,1,1,1,1,1,1,1,1,1],[1,1,1,1,1,1,1,1,1,1,1,1,1,1,1,1],[1,1,1,1,1,1,1,1,1,1,1,1,1,1,1,1],[1,1,1,1,1,1,1,1,1,1,1,1,1,1,1,1],[1,1,1,1,1,1,1,1,1,1,1,1,1,1,1,1],[1,1,1,1,1,1,1,1,1,1,1,1,1,1,1,1],[1,1,1,1,1,1,1,1,1,1,1,1,1,1,1,1],[1,1,1,1,1,1,1,1,1,1,1,1,1,1,1,1],[1,1,1,1,1,1,1,1,1,1,1,1,1,1,1,1]],"density":[[0.0,0.0,0.0,0.0,0.0,0.0,0.0,2.93,15.226,3.592,0.0,0.0,0.0,0.0,0.0,0.0],[0.0,0.0,0.0,0.0,0.0,0.0,0.0,6.512,11.506,4.599,0.0,0.0,0.0,0.0,0.0,0.0],[0.0,0.0,0.0,0.0,0.07,0.0,0.0,4.82,1.36,0.0,0.